### ISSUE TITLE
Redirect to captive page extremely slow

### ISSUE THREAD

**Issue by fabricat** [openwisp/OpenWISP-Captive-Portals-Manager#24]
It takes more than 1 minute to redirect the user to the configured captive page (sometimes the time exceeeds the browser timeout).

We experience the problem also on the latest version of your suite.

No applicative log is produced.
An excerpt of a tcpdump is reported below.

10:52:38.901444 IP 172.31.247.154.46396 > 173.194.70.106.80: Flags [P.], seq 1:742, ack 1, win 1825, options [nop,nop,TS val 3178934 ecr 186899], length 741
GET / HTTP/1.1
Host: www.google.com
Connection: keep-alive
Accept: text/html,application/xhtml+xml,application/xml;q=0.9,_/_;q=0.8
x-wap-profile: http://218.249.47.94/Xianghe/MTK_Phone_JB_UAprofile.xml
X-Requested-With: com.android.browser
User-Agent: Mozilla/5.0 (Linux; U; Android 4.2.2; it-it; S720c Build/S720c) AppleWebKit/534.30 (KHTML, like Gecko) Version/4.0 Mobile Safari/534.30
Accept-Encoding: gzip,deflate
Accept-Language: it-IT, en-US
Accept-Charset: utf-8, utf-16, *;q=0.7

10:52:38.901503 IP 173.194.70.106.80 > 172.31.247.154.46396: Flags [.], ack 742, win 57, options [nop,nop,TS val 186903 ecr 3178934], length 0

10:54:09.104881 IP 173.194.70.106.80 > 172.31.247.154.46396: Flags [P.], seq 1:748, ack 742, win 57, options [nop,nop,TS val 195923 ecr 3178934], length 747
HTTP/1.1 302 Found
Date: Fri, 02 May 2014 08:52:38 GMT
Server: Apache
Connection: close
X-Runtime: 90.201119
Expires: Fri, 01 Jan 1990 00:00:00 GMT
X-UA-Compatible: IE=Edge,chrome=1
Pragma: no-cache
Cache-Control: no-cache
X-Powered-By: Phusion Passenger 4.0.41
Location: https://hidden.captiveportal?original_url=http%3A%2F%2Fwww.google.com%2F
Status: 302 Found
Vary: Accept-Encoding
Content-Encoding: gzip
Content-Length: 197
Content-Type: text/html; charset=utf-8
